{
  "schema_version": "1.0",
  "deployment": {
    "id": "example-cmo",
    "display_name": "Cmo Reference",
    "profile": "cmo",
    "environment": "staging",
    "timezone": "UTC",
    "locale": "en-US",
    "jurisdiction": "CHANGE_ME",
    "data_residency": "local",
    "offline_mode": "degraded",
    "retention_days": 90
  },
  "organization": {
    "legal_name": "CHANGE_ME",
    "industry": "marketing_executive",
    "operator_roles": [
      "owner"
    ],
    "regulated": true,
    "compliance_frameworks": []
  },
  "geography": {
    "country_codes": [],
    "regions": [],
    "service_areas": [],
    "home_base": {
      "latitude": null,
      "longitude": null,
      "radius_km": null
    },
    "airports": [],
    "rail_stations": [],
    "weather": {
      "provider": "none",
      "nws_areas": [],
      "nws_wfos": []
    },
    "airspace": {
      "static_layers": [],
      "tfr_enabled": false
    },
    "distance_unit": "km",
    "currency": "USD"
  },
  "sources": {
    "enabled": [
      "analytics",
      "ad_platform",
      "crm"
    ],
    "disabled": [],
    "credentials_ref": {},
    "source_regions": {}
  },
  "modules": {
    "enabled": [
      "dashboard",
      "tasks",
      "notifications",
      "audit",
      "local_knowledge",
      "campaign_planning",
      "attribution",
      "brand_governance",
      "content_approvals",
      "consent_register",
      "analytics"
    ],
    "disabled": []
  },
  "workflows": {
    "objects": [
      "campaign",
      "creative",
      "audience",
      "consent_record",
      "budget",
      "report"
    ],
    "state_machine": [
      "planned",
      "approved",
      "launched",
      "measured",
      "reviewed",
      "closed"
    ],
    "triggers": [],
    "approvals": [
      "launch_campaign",
      "export_audience",
      "approve_ad_spend"
    ],
    "notifications": {
      "channels": [
        "in_app"
      ],
      "quiet_hours": {
        "start": "22:00",
        "end": "07:00"
      },
      "materiality_rules": []
    }
  },
  "security": {
    "network_exposure": "private_overlay",
    "default_deny": true,
    "human_signed_actions": [
      "publish",
      "deploy",
      "export_sensitive",
      "change_permissions"
    ],
    "agent_scopes": {},
    "secrets_backend": "host_protected",
    "pii_classes": [
      "customer_profiles",
      "consent_records",
      "ad_attribution"
    ],
    "audit": {
      "hash_chain": true,
      "independent_checkpoint": "required_for_high_assurance"
    },
    "backup": {
      "encrypted": true,
      "restore_test_required": true
    }
  },
  "build": {
    "target_platforms": [
      "linux/amd64"
    ],
    "signed_source_required": true,
    "receipt_required": true,
    "sbom_required": true,
    "runtime_image_identity_check": true
  },
  "integrations": {
    "optional": [],
    "forbidden": []
  },
  "deployment_gate": {
    "requires_operator_review": true,
    "requires_schema_validation": true,
    "requires_source_entitlements": true,
    "requires_test_replay": true,
    "requires_privacy_review": true
  }
}
