{
  "schema_version": "1.0",
  "deployment": {
    "id": "example-cfo",
    "display_name": "Cfo Reference",
    "profile": "cfo",
    "environment": "staging",
    "timezone": "UTC",
    "locale": "en-US",
    "jurisdiction": "CHANGE_ME",
    "data_residency": "local",
    "offline_mode": "degraded",
    "retention_days": 90
  },
  "organization": {
    "legal_name": "CHANGE_ME",
    "industry": "finance_executive",
    "operator_roles": [
      "owner"
    ],
    "regulated": true,
    "compliance_frameworks": []
  },
  "geography": {
    "country_codes": [],
    "regions": [],
    "service_areas": [],
    "home_base": {
      "latitude": null,
      "longitude": null,
      "radius_km": null
    },
    "airports": [],
    "rail_stations": [],
    "weather": {
      "provider": "none",
      "nws_areas": [],
      "nws_wfos": []
    },
    "airspace": {
      "static_layers": [],
      "tfr_enabled": false
    },
    "distance_unit": "km",
    "currency": "USD"
  },
  "sources": {
    "enabled": [
      "accounting_ledger",
      "bank_statement_import",
      "erp"
    ],
    "disabled": [],
    "credentials_ref": {},
    "source_regions": {}
  },
  "modules": {
    "enabled": [
      "dashboard",
      "tasks",
      "notifications",
      "audit",
      "local_knowledge",
      "budgeting",
      "cash_forecast",
      "close_checklist",
      "board_reporting",
      "variance_analysis",
      "controls_register"
    ],
    "disabled": []
  },
  "workflows": {
    "objects": [
      "ledger_import",
      "budget",
      "forecast",
      "variance",
      "approval",
      "board_pack"
    ],
    "state_machine": [
      "ingested",
      "reconciled",
      "reviewed",
      "approved",
      "reported",
      "archived"
    ],
    "triggers": [],
    "approvals": [
      "approve_payment",
      "change_bank_details",
      "release_financial_report"
    ],
    "notifications": {
      "channels": [
        "in_app"
      ],
      "quiet_hours": {
        "start": "22:00",
        "end": "07:00"
      },
      "materiality_rules": []
    }
  },
  "security": {
    "network_exposure": "private_overlay",
    "default_deny": true,
    "human_signed_actions": [
      "publish",
      "deploy",
      "export_sensitive",
      "change_permissions"
    ],
    "agent_scopes": {},
    "secrets_backend": "host_protected",
    "pii_classes": [
      "financial_records",
      "payroll",
      "banking_metadata"
    ],
    "audit": {
      "hash_chain": true,
      "independent_checkpoint": "required_for_high_assurance"
    },
    "backup": {
      "encrypted": true,
      "restore_test_required": true
    }
  },
  "build": {
    "target_platforms": [
      "host"
    ],
    "signed_source_required": true,
    "receipt_required": true,
    "sbom_required": true,
    "runtime_image_identity_check": true
  },
  "integrations": {
    "optional": [
      {
        "id": "firefly-iii",
        "kind": "container",
        "unit": "corporatetraveldc-firefly",
        "state": "disabled",
        "note": "ledger: budgets, categories, one tag per trip"
      },
      {
        "id": "paperless-ngx",
        "kind": "container",
        "unit": "corporatetraveldc-paperless",
        "state": "disabled",
        "shared_with": [
          "executive-assistant"
        ],
        "note": "receipt of record"
      },
      {
        "id": "pgsql-office",
        "kind": "database_instance",
        "unit": "corporatetraveldc-pgsql-office",
        "state": "disabled",
        "note": "office skeletons instance; one database and role per service"
      }
    ],
    "forbidden": [
      "sqlite_backend",
      "platform_env_files",
      "production_database"
    ]
  },
  "deployment_gate": {
    "requires_operator_review": true,
    "requires_schema_validation": true,
    "requires_source_entitlements": true,
    "requires_test_replay": true,
    "requires_privacy_review": true
  }
}
