{
  "schema_version": "1.0",
  "deployment": {
    "id": "example-chief-of-staff",
    "display_name": "Chief Of Staff Reference",
    "profile": "chief-of-staff",
    "environment": "staging",
    "timezone": "UTC",
    "locale": "en-US",
    "jurisdiction": "CHANGE_ME",
    "data_residency": "local",
    "offline_mode": "degraded",
    "retention_days": 90
  },
  "organization": {
    "legal_name": "CHANGE_ME",
    "industry": "executive_operations",
    "operator_roles": [
      "owner"
    ],
    "regulated": true,
    "compliance_frameworks": []
  },
  "geography": {
    "country_codes": [],
    "regions": [],
    "service_areas": [],
    "home_base": {
      "latitude": null,
      "longitude": null,
      "radius_km": null
    },
    "airports": [],
    "rail_stations": [],
    "weather": {
      "provider": "none",
      "nws_areas": [],
      "nws_wfos": []
    },
    "airspace": {
      "static_layers": [],
      "tfr_enabled": false
    },
    "distance_unit": "km",
    "currency": "USD"
  },
  "sources": {
    "enabled": [
      "document_repository",
      "task_board",
      "calendar"
    ],
    "disabled": [],
    "credentials_ref": {},
    "source_regions": {}
  },
  "modules": {
    "enabled": [
      "dashboard",
      "tasks",
      "notifications",
      "audit",
      "local_knowledge",
      "briefings",
      "decision_register",
      "initiative_tracking",
      "okr_tracking",
      "operating_cadence",
      "follow_up"
    ],
    "disabled": []
  },
  "workflows": {
    "objects": [
      "principal",
      "initiative",
      "objective",
      "key_result",
      "decision",
      "stakeholder",
      "brief",
      "action_item"
    ],
    "state_machine": [
      "proposed",
      "triaged",
      "approved",
      "in_progress",
      "at_risk",
      "completed",
      "archived"
    ],
    "triggers": [],
    "approvals": [
      "share_confidential_brief",
      "commit_budget",
      "close_initiative"
    ],
    "notifications": {
      "channels": [
        "in_app"
      ],
      "quiet_hours": {
        "start": "22:00",
        "end": "07:00"
      },
      "materiality_rules": []
    }
  },
  "security": {
    "network_exposure": "private_overlay",
    "default_deny": true,
    "human_signed_actions": [
      "publish",
      "deploy",
      "export_sensitive",
      "change_permissions"
    ],
    "agent_scopes": {},
    "secrets_backend": "host_protected",
    "pii_classes": [
      "confidential_business_strategy",
      "stakeholder_contacts"
    ],
    "audit": {
      "hash_chain": true,
      "independent_checkpoint": "required_for_high_assurance"
    },
    "backup": {
      "encrypted": true,
      "restore_test_required": true
    }
  },
  "build": {
    "target_platforms": [
      "host"
    ],
    "signed_source_required": true,
    "receipt_required": true,
    "sbom_required": true,
    "runtime_image_identity_check": true
  },
  "integrations": {
    "optional": [
      {
        "id": "nextcloud-deck",
        "kind": "nextcloud_app",
        "app": "deck",
        "state": "installed_disabled",
        "note": "initiative board"
      },
      {
        "id": "nextcloud-collectives",
        "kind": "nextcloud_app",
        "app": "collectives",
        "state": "installed_disabled",
        "note": "decision log, meeting notes"
      },
      {
        "id": "nextcloud-tables",
        "kind": "nextcloud_app",
        "app": "tables",
        "state": "installed_disabled",
        "note": "OKR and decision registers"
      },
      {
        "id": "vikunja",
        "kind": "container",
        "unit": "corporatetraveldc-vikunja",
        "state": "disabled",
        "optional": true,
        "note": "initiative and project API, if Deck is not enough"
      },
      {
        "id": "pgsql-office",
        "kind": "database_instance",
        "unit": "corporatetraveldc-pgsql-office",
        "state": "disabled",
        "note": "office skeletons instance; one database and role per service"
      }
    ],
    "forbidden": [
      "sqlite_backend",
      "platform_env_files",
      "production_database"
    ]
  },
  "deployment_gate": {
    "requires_operator_review": true,
    "requires_schema_validation": true,
    "requires_source_entitlements": true,
    "requires_test_replay": true,
    "requires_privacy_review": true
  }
}
